{
  "schema" : "santa-authds/v1",
  "op" : "authds:vendored:avl-prove",
  "blessed_by" : "jvm:scrypto-3.0.0",
  "source" : "ergots:packages/avltree/test/fixtures/prover",
  "entries" : [
    {
      "name" : "batch-3-inserts",
      "source" : "ergots:packages/avltree/test/fixtures/prover/batch-3-inserts.json",
      "kind" : "avl_prove",
      "settings" : {
        "key_length" : 32,
        "value_length" : null
      },
      "payload" : {
        "operations" : [
          {
            "tag" : "Insert",
            "key_hex" : "aaaaaaaaaaaaaaaaaaaaaaaaaaaaaaaaaaaaaaaaaaaaaaaaaaaaaaaaaaaaaaaa",
            "value_hex" : "0102"
          },
          {
            "tag" : "Insert",
            "key_hex" : "bbbbbbbbbbbbbbbbbbbbbbbbbbbbbbbbbbbbbbbbbbbbbbbbbbbbbbbbbbbbbbbb",
            "value_hex" : "0304"
          },
          {
            "tag" : "Insert",
            "key_hex" : "cccccccccccccccccccccccccccccccccccccccccccccccccccccccccccccccc",
            "value_hex" : "0506"
          }
        ],
        "gen_proof_after" : [
          2
        ]
      },
      "expected" : {
        "proofs" : [
          "020000000000000000000000000000000000000000000000000000000000000000ffffffffffffffffffffffffffffffffffffffffffffffffffffffffffffffff000000000400"
        ],
        "digests" : [
          "b78df87662a5715179965dfd1169453c6738203c0027c416817348ac1b4dd50202"
        ]
      }
    },
    {
      "name" : "batch-insert-remove",
      "source" : "ergots:packages/avltree/test/fixtures/prover/batch-insert-remove.json",
      "kind" : "avl_prove",
      "settings" : {
        "key_length" : 32,
        "value_length" : null
      },
      "payload" : {
        "operations" : [
          {
            "tag" : "Insert",
            "key_hex" : "4242424242424242424242424242424242424242424242424242424242424242",
            "value_hex" : "01020304"
          },
          {
            "tag" : "Remove",
            "key_hex" : "4242424242424242424242424242424242424242424242424242424242424242"
          }
        ],
        "gen_proof_after" : [
          1
        ]
      },
      "expected" : {
        "proofs" : [
          "020000000000000000000000000000000000000000000000000000000000000000ffffffffffffffffffffffffffffffffffffffffffffffffffffffffffffffff000000000400"
        ],
        "digests" : [
          "4ec61f485b98eb87153f7c57db4f5ecd75556fddbc403b41acf8441fde8e160900"
        ]
      }
    },
    {
      "name" : "fixed-value-insert-genproof-remove",
      "source" : "ergots:packages/avltree/test/fixtures/prover/fixed-value-insert-genproof-remove.json",
      "kind" : "avl_prove",
      "settings" : {
        "key_length" : 32,
        "value_length" : 8
      },
      "payload" : {
        "operations" : [
          {
            "tag" : "Insert",
            "key_hex" : "4242424242424242424242424242424242424242424242424242424242424242",
            "value_hex" : "0102030405060708"
          },
          {
            "tag" : "Remove",
            "key_hex" : "4242424242424242424242424242424242424242424242424242424242424242"
          }
        ],
        "gen_proof_after" : [
          0,
          1
        ]
      },
      "expected" : {
        "proofs" : [
          "020000000000000000000000000000000000000000000000000000000000000000ffffffffffffffffffffffffffffffffffffffffffffffffffffffffffffffff000000000000000004",
          "0200000000000000000000000000000000000000000000000000000000000000004242424242424242424242424242424242424242424242424242424242424242000000000000000002ffffffffffffffffffffffffffffffffffffffffffffffffffffffffffffffff0102030405060708000400"
        ],
        "digests" : [
          "df3e8faa3e2ce193a679b4f6eeb76de180f2eca8a662d83055fc62773a183a3101",
          "aebde47e15b6bfb577265ea5a819f5779328085286d86e7e1089636641dae9b800"
        ]
      }
    },
    {
      "name" : "insert-genproof-lookup-genproof",
      "source" : "ergots:packages/avltree/test/fixtures/prover/insert-genproof-lookup-genproof.json",
      "kind" : "avl_prove",
      "settings" : {
        "key_length" : 32,
        "value_length" : null
      },
      "payload" : {
        "operations" : [
          {
            "tag" : "Insert",
            "key_hex" : "0707070707070707070707070707070707070707070707070707070707070707",
            "value_hex" : "0909"
          },
          {
            "tag" : "Lookup",
            "key_hex" : "0707070707070707070707070707070707070707070707070707070707070707"
          }
        ],
        "gen_proof_after" : [
          0,
          1
        ]
      },
      "expected" : {
        "proofs" : [
          "020000000000000000000000000000000000000000000000000000000000000000ffffffffffffffffffffffffffffffffffffffffffffffffffffffffffffffff0000000004",
          "0352665e83dc9366d2aed9115104d6103ef076f72b42ba35b4243dba36eec47f8f020707070707070707070707070707070707070707070707070707070707070707ffffffffffffffffffffffffffffffffffffffffffffffffffffffffffffffff000000020909000400"
        ],
        "digests" : [
          "cd964e1af6dfa7d20d9bf121c44dcf1605b7deb5aa047874b0246d0f4285947301",
          "cd964e1af6dfa7d20d9bf121c44dcf1605b7deb5aa047874b0246d0f4285947301"
        ]
      }
    },
    {
      "name" : "insert-genproof-remove-genproof",
      "source" : "ergots:packages/avltree/test/fixtures/prover/insert-genproof-remove-genproof.json",
      "kind" : "avl_prove",
      "settings" : {
        "key_length" : 32,
        "value_length" : null
      },
      "payload" : {
        "operations" : [
          {
            "tag" : "Insert",
            "key_hex" : "4242424242424242424242424242424242424242424242424242424242424242",
            "value_hex" : "01020304"
          },
          {
            "tag" : "Remove",
            "key_hex" : "4242424242424242424242424242424242424242424242424242424242424242"
          }
        ],
        "gen_proof_after" : [
          0,
          1
        ]
      },
      "expected" : {
        "proofs" : [
          "020000000000000000000000000000000000000000000000000000000000000000ffffffffffffffffffffffffffffffffffffffffffffffffffffffffffffffff0000000004",
          "02000000000000000000000000000000000000000000000000000000000000000042424242424242424242424242424242424242424242424242424242424242420000000002ffffffffffffffffffffffffffffffffffffffffffffffffffffffffffffffff0000000401020304000400"
        ],
        "digests" : [
          "12a83992f8707b2d9d135fcc6b62d6707f77ea6193a8f0e0adb1751474f3df8101",
          "4ec61f485b98eb87153f7c57db4f5ecd75556fddbc403b41acf8441fde8e160900"
        ]
      }
    },
    {
      "name" : "insert-genproof-updatelongby-genproof",
      "source" : "ergots:packages/avltree/test/fixtures/prover/insert-genproof-updatelongby-genproof.json",
      "kind" : "avl_prove",
      "settings" : {
        "key_length" : 32,
        "value_length" : 8
      },
      "payload" : {
        "operations" : [
          {
            "tag" : "Insert",
            "key_hex" : "4242424242424242424242424242424242424242424242424242424242424242",
            "value_hex" : "6400000000000000"
          },
          {
            "tag" : "UpdateLongBy",
            "key_hex" : "4242424242424242424242424242424242424242424242424242424242424242",
            "delta" : "50"
          }
        ],
        "gen_proof_after" : [
          0,
          1
        ]
      },
      "expected" : {
        "proofs" : [
          "020000000000000000000000000000000000000000000000000000000000000000ffffffffffffffffffffffffffffffffffffffffffffffffffffffffffffffff000000000000000004",
          "03cb739332d7f0b9846fdd2dfb1acd06aa12e61921961f1aef82473e514f87af14024242424242424242424242424242424242424242424242424242424242424242ffffffffffffffffffffffffffffffffffffffffffffffffffffffffffffffff6400000000000000000400"
        ],
        "digests" : [
          "76f29ed08e3096146f125536c1eed27fbc3a9027fe364293dc037e598af1d75201",
          "d059d98deeec3c1ddf8f05a5799544f6ce457a9530f45992368c0a9a0ee9d3df01"
        ]
      }
    },
    {
      "name" : "insert-single",
      "source" : "ergots:packages/avltree/test/fixtures/prover/insert-single.json",
      "kind" : "avl_prove",
      "settings" : {
        "key_length" : 32,
        "value_length" : null
      },
      "payload" : {
        "operations" : [
          {
            "tag" : "Insert",
            "key_hex" : "4242424242424242424242424242424242424242424242424242424242424242",
            "value_hex" : "01020304"
          }
        ],
        "gen_proof_after" : [
          0
        ]
      },
      "expected" : {
        "proofs" : [
          "020000000000000000000000000000000000000000000000000000000000000000ffffffffffffffffffffffffffffffffffffffffffffffffffffffffffffffff0000000004"
        ],
        "digests" : [
          "12a83992f8707b2d9d135fcc6b62d6707f77ea6193a8f0e0adb1751474f3df8101"
        ]
      }
    },
    {
      "name" : "insertorupdate-genproof-remove-genproof",
      "source" : "ergots:packages/avltree/test/fixtures/prover/insertorupdate-genproof-remove-genproof.json",
      "kind" : "avl_prove",
      "settings" : {
        "key_length" : 32,
        "value_length" : null
      },
      "payload" : {
        "operations" : [
          {
            "tag" : "InsertOrUpdate",
            "key_hex" : "5555555555555555555555555555555555555555555555555555555555555555",
            "value_hex" : "070707"
          },
          {
            "tag" : "Remove",
            "key_hex" : "5555555555555555555555555555555555555555555555555555555555555555"
          }
        ],
        "gen_proof_after" : [
          0,
          1
        ]
      },
      "expected" : {
        "proofs" : [
          "020000000000000000000000000000000000000000000000000000000000000000ffffffffffffffffffffffffffffffffffffffffffffffffffffffffffffffff0000000004",